{
  "$schema": "https://json-schema.org/draft/2020-12/schema",
  "$id": "https://egohygiene.io/schemas/empathy/repository-foundation-manifest.v1.schema.json",
  "title": "Empathy repository foundation selection v1",
  "type": "object",
  "additionalProperties": false,
  "required": [
    "schema_version",
    "repository",
    "foundation",
    "selected_profiles",
    "overrides",
    "repository_owned"
  ],
  "properties": {
    "schema_version": { "const": "1.1.0" },
    "repository": { "type": "string", "pattern": "^[a-z0-9.-]+/[a-z0-9.-]+$" },
    "foundation": { "const": "empathy/repository-foundation@2.0.0" },
    "selected_profiles": {
      "type": "array",
      "minItems": 1,
      "uniqueItems": true,
      "items": { "type": "string", "minLength": 1 }
    },
    "overrides": {
      "type": "array",
      "uniqueItems": true,
      "items": {
        "type": "object",
        "additionalProperties": false,
        "required": ["artifact", "mode"],
        "properties": {
          "artifact": { "type": "string", "minLength": 1 },
          "mode": { "const": "preserve" }
        }
      }
    },
    "gitignore": {
      "type": "object",
      "additionalProperties": false,
      "required": ["scopes"],
      "properties": {
        "scopes": {
          "type": "array",
          "minItems": 1,
          "items": {
            "type": "object",
            "additionalProperties": false,
            "required": ["root", "overlays", "local_additions"],
            "properties": {
              "root": {
                "type": "string",
                "minLength": 1
              },
              "overlays": {
                "type": "array",
                "uniqueItems": true,
                "items": {
                  "type": "string",
                  "minLength": 1
                }
              },
              "local_additions": {
                "type": "string"
              }
            }
          }
        }
      }
    },
    "repository_owned": {
      "type": "object",
      "additionalProperties": {
        "oneOf": [
          { "type": "string" },
          {
            "type": "array",
            "items": { "type": "string" },
            "uniqueItems": true
          }
        ]
      }
    }
  }
}
