{
  "schema_version": "1.1.0",
  "repository": "egohygiene/empathy",
  "foundation": "empathy/repository-foundation@2.0.0",
  "selected_profiles": [
    "agent-context",
    "community-health",
    "language-node",
    "language-rust",
    "product",
    "release-automated",
    "risk-hardened"
  ],
  "overrides": [
    {
      "artifact": "issue-template-config",
      "mode": "preserve"
    },
    {
      "artifact": "megalinter-config",
      "mode": "preserve"
    }
  ],
  "gitignore": {
    "scopes": [
      {
        "root": ".",
        "overlays": ["rust-build"],
        "local_additions": "# Empathy-owned integration rules; see docs/foundation/gitignore/MIGRATION-03.md.\n# Generated quality reports; retain the existing curated evidence exceptions.\n/.reports/*\n!/.reports/README.md\n!/.reports/egolint/\n/.reports/egolint/*\n!/.reports/egolint/architecture/\n!/.reports/egolint/architecture/README.md\n!/.reports/egolint/architecture/lint-architecture.svg\n!/.reports/megalinter/\n/.reports/megalinter/*\n!/.reports/megalinter/remediation.md\n\n# Repository intelligence and the selected root Mindgarden/Obsidian vault.\n/docs/generated/\n/.garden.local/\n/.garden/.index/\n/.obsidian/plugins/\n/.obsidian/workspace*.json\n\n# Root Python tooling: observed Ruff cache and the configured pytest project.\n/.ruff_cache/\n/.pytest_cache/\n\n# Imported Cargo projects without their own ignore file; root Rust uses the overlay.\n/beacon/target/\n/.staging/devenvironment/realm/target/\n\n# Executable language fixtures, scoped to their owning projects.\n/egolint/tests/fixtures/raku/**/.precomp/\n/egolint/tests/fixtures/dart-analyzer/.dart_tool/\n/egolint/tests/fixtures/dart-analyzer/.packages\n/.staging/.github/skills/winmd-api-search/scripts/cache-generator/bin/\n/.staging/.github/skills/winmd-api-search/scripts/cache-generator/obj/\n\n# Private key material mounted by the imported Apache development configuration.\n# Public certificates and keys used as reviewed fixtures elsewhere remain visible.\n/.staging/devenvironment/containers/services/apache/certs/**/*.key\n\n# Private Terraform state, plans, and auto-loaded variables at the actual IaC fixtures.\n# Other private material belongs in .secrets/; reviewed *.tfvars elsewhere stay visible.\n/egolint/tests/fixtures/kics/terraform/.terraform/\n/egolint/tests/fixtures/kics/terraform/terraform.tfstate\n/egolint/tests/fixtures/kics/terraform/terraform.tfstate.*\n/egolint/tests/fixtures/kics/terraform/.terraform.tfstate.lock.info\n/egolint/tests/fixtures/kics/terraform/terraform.tfvars\n/egolint/tests/fixtures/kics/terraform/terraform.tfvars.json\n/egolint/tests/fixtures/kics/terraform/*.auto.tfvars\n/egolint/tests/fixtures/kics/terraform/*.auto.tfvars.json\n/egolint/tests/fixtures/kics/terraform/*.tfplan\n/egolint/tests/fixtures/tflint/.terraform/\n/egolint/tests/fixtures/tflint/terraform.tfstate\n/egolint/tests/fixtures/tflint/terraform.tfstate.*\n/egolint/tests/fixtures/tflint/.terraform.tfstate.lock.info\n/egolint/tests/fixtures/tflint/terraform.tfvars\n/egolint/tests/fixtures/tflint/terraform.tfvars.json\n/egolint/tests/fixtures/tflint/*.auto.tfvars\n/egolint/tests/fixtures/tflint/*.auto.tfvars.json\n/egolint/tests/fixtures/tflint/*.tfplan\n/egolint/tests/fixtures/negative/terraform-fmt/.terraform/\n/egolint/tests/fixtures/negative/terraform-fmt/terraform.tfstate\n/egolint/tests/fixtures/negative/terraform-fmt/terraform.tfstate.*\n/egolint/tests/fixtures/negative/terraform-fmt/.terraform.tfstate.lock.info\n/egolint/tests/fixtures/negative/terraform-fmt/terraform.tfvars\n/egolint/tests/fixtures/negative/terraform-fmt/terraform.tfvars.json\n/egolint/tests/fixtures/negative/terraform-fmt/*.auto.tfvars\n/egolint/tests/fixtures/negative/terraform-fmt/*.auto.tfvars.json\n/egolint/tests/fixtures/negative/terraform-fmt/*.tfplan\n"
      }
    ]
  },
  "repository_owned": {
    "display_name": "Empathy",
    "description": "Golden repository baseline and integration consumer for Ego Hygiene",
    "maintainers": ["szmyty"],
    "topics": ["developer-experience", "golden-repository", "integration"],
    "domains": [],
    "license_expression": "MIT"
  }
}
